{
  "$schema": "https://json-schema.org/draft/2020-12/schema",
  "$id": "https://multikernel.example/schemas/kernel-manifest-v1.schema.json",
  "type": "object",
  "additionalProperties": false,
  "required": ["schema_version", "name", "architecture", "kernel_release", "compatibility", "kernel", "initramfs", "agent", "relay", "transport", "protocol", "required_config", "oci_features"],
  "properties": {
    "schema_version": {"const": 1},
    "name": {"type": "string", "pattern": "^[a-z][a-z0-9.-]{0,62}$"},
    "architecture": {"const": "amd64"},
    "kernel_release": {"type": "string", "minLength": 1, "maxLength": 128},
    "compatibility": {
      "type": "object", "additionalProperties": false,
      "required": ["multikernel_revision", "kerf_version", "kerf_revision"],
      "properties": {
        "multikernel_revision": {"type": "string", "pattern": "^[a-f0-9]{40}$"},
        "kerf_version": {"type": "string", "pattern": "^v[0-9]+\\.[0-9]+\\.[0-9]+$"},
        "kerf_revision": {"type": "string", "pattern": "^[a-f0-9]{40}$"}
      }
    },
    "kernel": {"$ref": "#/$defs/artifact"},
    "initramfs": {"$ref": "#/$defs/artifact"},
    "agent": {"$ref": "#/$defs/artifact"},
    "relay": {"$ref": "#/$defs/artifact"},
    "transport": {
      "type": "object", "additionalProperties": false,
      "required": ["module", "module_name", "socket_option", "transport_id", "primary_role", "child_role"],
      "properties": {
        "module": {"$ref": "#/$defs/artifact"},
        "module_name": {"const": "mk_transport"},
        "socket_option": {"const": 9},
        "transport_id": {"const": 1},
        "primary_role": {"const": "server"},
        "child_role": {"const": "client"}
      }
    },
    "protocol": {"type": "object", "required": ["min", "max"], "properties": {"min": {"type": "integer", "minimum": 1}, "max": {"type": "integer", "minimum": 1}}, "additionalProperties": false},
    "required_config": {"type": "array", "items": {"type": "string", "pattern": "^CONFIG_[A-Z0-9_]+=[ym]$"}, "uniqueItems": true},
    "modules": {"type": "array", "items": {"$ref": "#/$defs/artifact"}},
    "oci_features": {"type": "array", "items": {"type": "string"}, "uniqueItems": true},
    "docker_guest": {
      "type": "object", "additionalProperties": false,
      "required": ["kind", "rootfs_manifest_sha256", "bootstrap", "modules"],
      "properties": {
        "kind": {"const": "docker-rootless-offline-v1"},
        "rootfs_manifest_sha256": {"type": "string", "pattern": "^[a-f0-9]{64}$"},
        "bootstrap": {"$ref": "#/$defs/artifact"},
        "modules": {
          "type": "object", "additionalProperties": false,
          "required": ["llc", "stp", "bridge", "veth"],
          "properties": {
            "llc": {"$ref": "#/$defs/artifact"},
            "stp": {"$ref": "#/$defs/artifact"},
            "bridge": {"$ref": "#/$defs/artifact"},
            "veth": {"$ref": "#/$defs/artifact"}
          }
        }
      }
    }
  },
  "$defs": {
    "artifact": {
      "type": "object", "additionalProperties": false,
      "required": ["path", "sha256"],
      "properties": {"path": {"type": "string", "pattern": "^/"}, "sha256": {"type": "string", "pattern": "^[a-f0-9]{64}$"}}
    }
  }
}
